{
  "$schema": "https://json-schema.org/draft/2020-12/schema",
  "$id": "https://wstein.github.io/picocli/jsonspec/schema/command-spec.schema.json",
  "title": "picocli-jsonspec command spec",
  "description": "The JSON format read and written by picocli.jsonspec.CommandSpecJson: describes a picocli CommandSpec (a command's options and positional parameters, plus any nested subcommands) without an annotated Java class. Compiling picocli.jsonspec.CommandSpecDsl's DSL produces a CommandSpec that serializes to exactly this shape. Note: this schema is intentionally a little stricter than CommandSpecJson.read() itself, to help editors/validators catch likely mistakes -- see the two 'Stricter than the reader' notes below.",
  "$ref": "#/$defs/command",
  "$defs": {
    "command": {
      "type": "object",
      "additionalProperties": false,
      "properties": {
        "name": {
          "type": "string",
          "description": "The command's name. Optional at the document root (an unnamed root keeps picocli's own default); required on every entry inside \"subcommands\", since CommandSpecMerger and ordinary use both need it to address the subcommand."
        },
        "description": { "$ref": "#/$defs/descriptionLines" },
        "options": {
          "type": "array",
          "items": { "$ref": "#/$defs/option" }
        },
        "positionalParams": {
          "type": "array",
          "items": { "$ref": "#/$defs/positionalParam" }
        },
        "subcommands": {
          "type": "array",
          "items": { "$ref": "#/$defs/namedCommand" }
        }
      }
    },
    "namedCommand": {
      "allOf": [ { "$ref": "#/$defs/command" } ],
      "required": ["name"],
      "description": "Stricter than the reader: CommandSpecJson.read() does not actually reject an unnamed subcommand entry (it falls back to picocli's placeholder command name), but that is almost always a mistake."
    },
    "option": {
      "type": "object",
      "additionalProperties": false,
      "required": ["names"],
      "properties": {
        "names": {
          "type": "array",
          "items": { "type": "string" },
          "minItems": 1,
          "description": "One or more option names, e.g. [\"-v\", \"--verbose\"]."
        },
        "type": { "$ref": "#/$defs/type" },
        "description": { "$ref": "#/$defs/descriptionLines" },
        "defaultValue": { "$ref": "#/$defs/defaultValue" },
        "required": { "$ref": "#/$defs/required" },
        "arity": { "$ref": "#/$defs/arity" }
      }
    },
    "positionalParam": {
      "type": "object",
      "additionalProperties": false,
      "properties": {
        "paramLabel": {
          "type": "string",
          "description": "Defaults to \"PARAM\" (picocli's own default) if omitted."
        },
        "type": { "$ref": "#/$defs/type" },
        "description": { "$ref": "#/$defs/descriptionLines" },
        "defaultValue": { "$ref": "#/$defs/defaultValue" },
        "required": { "$ref": "#/$defs/required" },
        "arity": { "$ref": "#/$defs/arity" }
      }
    },
    "descriptionLines": {
      "type": "array",
      "items": { "type": "string" },
      "description": "One entry per usage-help line."
    },
    "type": {
      "type": "string",
      "enum": ["String", "boolean", "int", "long", "double", "File"],
      "description": "See picocli.jsonspec.ArgTypes. Scalar types only, by design; array/Collection-typed options and positional parameters are not yet supported."
    },
    "defaultValue": {
      "type": "string",
      "description": "Applied as the default when the option/positional is not matched on the command line. Stricter than the reader: CommandSpecJson.read() actually accepts any JSON scalar here (numbers, booleans) and stringifies it, but a JSON string is the documented, forward-compatible contract. Note picocli itself reports an argument as not required (ArgSpec#required()) whenever it has a default value, regardless of the \"required\" field below."
    },
    "required": {
      "type": "boolean",
      "default": false
    },
    "arity": {
      "type": "string",
      "pattern": "^[0-9]+(\\.\\.([0-9]+|\\*))?$",
      "examples": ["0", "1", "0..1", "1..*", "0..*"],
      "description": "Parsed by picocli.CommandLine.Model.Range.valueOf(String): a single count, or a min..max range where max may be \"*\" for unbounded."
    }
  }
}
