{
  "name": "flix",
  "description": [
    "The Flix programming language"
  ],
  "options": [
    {
      "names": [
        "-v",
        "--verbose"
      ],
      "type": "boolean",
      "description": [
        "Enable verbose output"
      ],
      "arity": "0"
    },
    {
      "names": [
        "-o",
        "--output"
      ],
      "type": "String",
      "description": [
        "Output directory"
      ],
      "defaultValue": "out",
      "arity": "1"
    },
    {
      "names": [
        "-t",
        "--target"
      ],
      "type": "String",
      "description": [
        "Compilation target"
      ],
      "required": true,
      "arity": "1"
    }
  ],
  "subcommands": [
    {
      "name": "build",
      "description": [
        "Compile the project"
      ],
      "options": [
        {
          "names": [
            "--release"
          ],
          "type": "boolean",
          "description": [
            "Optimize for release"
          ],
          "arity": "0"
        }
      ],
      "positionalParams": [
        {
          "paramLabel": "<files>",
          "type": "File",
          "description": [
            "Input files to compile"
          ],
          "arity": "0..*"
        }
      ]
    },
    {
      "name": "run",
      "description": [
        "Run the project"
      ],
      "positionalParams": [
        {
          "paramLabel": "<args>",
          "type": "String",
          "description": [
            "Program arguments"
          ],
          "arity": "0..*"
        }
      ]
    }
  ]
}
